"","name","price","reviews","delivery"
"1","Trendy Retro Women Tops & Tunics","₹232 onwards","45 Reviews","Free Delivery"
"2","Trendy Feminine Women Tops & Tunics","₹283 onwards","727 Reviews","Free Delivery"
"3","Stylish Modern Women Tops & Tunics","₹269 onwards","624 Reviews","Free Delivery"
"4","Trendy Latest Women Tops & Tunics","₹217 onwards","104 Reviews","Free Delivery"
"5","Urbane Feminine Women Tops & Tunics","₹241 onwards","44 Reviews","Free Delivery"
"6","Fancy Sensational Women Tops & Tunics","₹236 onwards","4591 Reviews","Free Delivery"
"7","Comfy Designer Women Tops & Tunics","₹101 onwards","177 Reviews","Free Delivery"
"8","Urbane Feminine Women Tops","₹358 onwards","81 Reviews","Free Delivery"
"9","Trendy Fabulous Women Tops & Tunics","₹272 onwards","95 Reviews","Free Delivery"
"10","Trendy Fashionable Women Tops & Tunics","₹197 onwards","146 Reviews","Free Delivery"
"11","Trendy Modern Women Tops & Tunics","₹234 onwards","161 Reviews","Free Delivery"
"12","Classic Fashionable Women Tops & Tunics","₹303 onwards","45 Reviews","Free Delivery"
"13","Casual  Tops & Tunics","₹240 onwards","144 Reviews","Free Delivery"
"14","Aagam Petite Tops & Tunics","₹341 onwards","22 Reviews","Free Delivery"
"15","Comfy Elegant Women Tops & Tunics","₹234 onwards","71 Reviews","Free Delivery"
"16","Classic Fabulous Women Tops & Tunics","₹234 onwards","83 Reviews","Free Delivery"
"17","Stylish Graceful Women Tops & Tunics","₹252 onwards","61 Reviews","Free Delivery"
"18","Trendy Retro Women Tops & Tunics","₹200 onwards","88 Reviews","Free Delivery"
"19","Classic Latest Women Tops & Tunics","₹227 onwards","1036 Reviews","Free Delivery"
"20","Stylish Partywear Women Tops & Tunics","₹389 onwards","221 Reviews","Free Delivery"
